{
  "set": "part3-core",
  "part": 3,
  "version": 1,
  "entries": [
    {
      "id": "p3-0001",
      "set": "part3-core",
      "part": 3,
      "status": "active",
      "kind": "conversation",
      "title": "Office Equipment Repair",
      "script": [
        {
          "speaker": "Woman",
          "text": "Hi, Steve. The heavy-duty plotter in the design room is acting up again. It's leaving dark streaks across the blueprints."
        },
        {
          "speaker": "Man",
          "text": "Oh, no. We just had the rollers replaced last week. Let me check the maintenance log... Well, actually, it says here the technician only cleaned the optical sensor, they didn't replace any parts."
        },
        {
          "speaker": "Woman",
          "text": "Really? But we paid for a full overhaul! We have a major presentation tomorrow morning, and we need those high-res prints."
        },
        {
          "speaker": "Man",
          "text": "Right. I'll call the service center immediately and demand an emergency visit. In the meantime, could you try sending the files to the marketing department's printer?"
        },
        {
          "speaker": "Woman",
          "text": "I would, but their network is down today. I guess I'll have to copy the files to a flash drive and walk over there."
        }
      ],
      "questions": [
        {
          "id": "p3-0001-1",
          "stem": "Why is the woman talking to the man?",
          "options": {
            "A": "To report a recurring issue with a machine.",
            "B": "To request a refund for a faulty repair.",
            "C": "To ask for help installing a new printer.",
            "D": "To complain about the marketing department's network."
          },
          "answer": "A",
          "errorType": "purpose",
          "explanation": "Người phụ nữ bắt đầu cuộc đối thoại bằng cách thông báo rằng máy vẽ trong phòng thiết kế lại gặp trục trặc và để lại các vệt đen trên bản vẽ.",
          "trap": "Người nghe dễ bị lừa chọn phương án yêu cầu hoàn tiền vì người phụ nữ có nhắc đến việc đã trả tiền cho một đợt đại tu toàn bộ nhưng không được thực hiện đúng."
        },
        {
          "id": "p3-0001-2",
          "stem": "What does the man imply about the previous maintenance service?",
          "options": {
            "A": "It was completed ahead of schedule.",
            "B": "The work performed did not match what was expected.",
            "C": "It was done free of charge.",
            "D": "It caused the network outage."
          },
          "answer": "B",
          "errorType": "inference",
          "explanation": "Người đàn ông kiểm tra nhật ký bảo trì và nhận ra kỹ thuật viên chỉ vệ sinh cảm biến quang học chứ không thay thế linh kiện nào, trong khi người phụ nữ khẳng định họ đã trả tiền cho một đợt đại tu toàn bộ.",
          "trap": "Phương án liên quan đến sự cố mạng dễ gây nhầm lẫn vì chi tiết mạng bị hỏng được nhắc đến ngay sau đó, nhưng nó thuộc về phòng marketing chứ không liên quan đến dịch vụ bảo trì."
        },
        {
          "id": "p3-0001-3",
          "stem": "What will the woman do next?",
          "options": {
            "A": "Call the repair technician.",
            "B": "Contact the marketing department manager.",
            "C": "Transfer some data to a portable storage device.",
            "D": "Print the blueprints on the design room plotter."
          },
          "answer": "C",
          "errorType": "next-action",
          "explanation": "Ở lượt nói cuối cùng, người phụ nữ quyết định sẽ sao chép các tệp tin vào ổ cứng di động (flash drive) để mang sang phòng marketing in nhờ.",
          "trap": "Người nghe dễ chọn phương án gọi cho kỹ thuật viên sửa chữa vì đây là hành động được đề xuất trong cuộc thoại, nhưng người thực hiện việc đó là người đàn ông chứ không phải người phụ nữ."
        }
      ],
      "gen": {
        "model": "gemini-3.5-flash",
        "promptVersion": "sets-v1",
        "batch": "2026-09-20",
        "date": "2026-09-20"
      },
      "verify": {
        "model": "gemini-flash-lite-latest",
        "agreed": true
      },
      "audio": {
        "clips": [
          "audio/e3b9be4abad44584.mp3",
          "audio/a0d96bef3d76d534.mp3",
          "audio/4333ff2d2f99d4ee.mp3",
          "audio/3ae4af83050afd15.mp3",
          "audio/a696fd170da17f7e.mp3"
        ],
        "voices": {
          "Woman": "en-US-JennyNeural",
          "Man": "en-US-GuyNeural"
        }
      }
    },
    {
      "id": "p3-0002",
      "set": "part3-core",
      "part": 3,
      "status": "active",
      "kind": "conversation",
      "title": "Hiring and Interviews",
      "script": [
        {
          "speaker": "Man",
          "text": "So, what did you think of the last candidate for the senior developer position, Sarah?"
        },
        {
          "speaker": "Woman",
          "text": "Well, his portfolio is impressive, but honestly, his answers during the technical round were a bit... superficial. He struggled to explain how he'd handle server scalability."
        },
        {
          "speaker": "Man",
          "text": "I noticed that too. However, his references highly praised his leadership skills, which we desperately need for the new team."
        },
        {
          "speaker": "Woman",
          "text": "True, but without strong technical foundations, he might struggle to earn the developers' respect. Let's look at the other applicant, Maya."
        },
        {
          "speaker": "Man",
          "text": "Actually, Maya just emailed me to withdraw her application. She accepted another offer."
        },
        {
          "speaker": "Woman",
          "text": "Oh, that's a shame. In that case, let's invite the first candidate back for a second, more targeted interview focusing on system architecture."
        }
      ],
      "questions": [
        {
          "id": "p3-0002-1",
          "stem": "What is the main topic of the conversation?",
          "options": {
            "A": "Planning a technical training session.",
            "B": "Negotiating a job offer.",
            "C": "Resolving a conflict among developers.",
            "D": "Evaluating a potential employee."
          },
          "answer": "D",
          "errorType": "gist",
          "explanation": "Hai người nói chuyện đang thảo luận và đánh giá các ứng viên cho vị trí lập trình viên cao cấp.",
          "trap": "Phương án thương lượng lời mời nhận việc dễ gây bẫy vì có chi tiết ứng viên khác đã nhận một lời mời làm việc khác, nhưng đây không phải chủ đề chính của cuộc đối thoại."
        },
        {
          "id": "p3-0002-2",
          "stem": "What is suggested about Maya?",
          "options": {
            "A": "She was a highly competitive candidate in the job market.",
            "B": "She lacked the necessary leadership experience.",
            "C": "She withdrew because of a low salary offer.",
            "D": "She was the woman's preferred choice."
          },
          "answer": "A",
          "errorType": "inference",
          "explanation": "Chi tiết Maya rút hồ sơ vì đã đồng ý nhận một lời mời làm việc khác cho thấy cô ấy là một ứng viên rất thu hút và có sức cạnh tranh cao trên thị trường tuyển dụng.",
          "trap": "Người nghe dễ suy diễn rằng cô ấy là lựa chọn ưu tiên của người phụ nữ do người phụ nữ tỏ ra tiếc nuối, nhưng trong bài không có thông tin nào khẳng định cô ấy được đánh giá cao hơn ứng viên thứ nhất."
        },
        {
          "id": "p3-0002-3",
          "stem": "What does the woman mean when she says, \"True, but without strong technical foundations, he might struggle to earn the developers' respect\"?",
          "options": {
            "A": "She wants to demote the current developers.",
            "B": "She believes technical expertise is crucial for the leadership role.",
            "C": "She thinks the candidate should apply for a junior role.",
            "D": "She is concerned about the candidate's communication skills."
          },
          "answer": "B",
          "errorType": "speaker-intent",
          "explanation": "Người phụ nữ muốn nhấn mạnh rằng dù ứng viên có khả năng lãnh đạo tốt, anh ta vẫn cần có nền tảng kỹ thuật vững chắc để có thể thuyết phục và nhận được sự tôn trọng từ các lập trình viên dưới quyền.",
          "trap": "Phương án lo ngại về kỹ năng giao tiếp dễ đánh lừa người nghe vì cụm từ 'earn respect' liên quan đến mối quan hệ giữa người với người, nhưng thực chất cốt lõi vấn đề người phụ nữ lo ngại là kiến thức kỹ thuật."
        }
      ],
      "gen": {
        "model": "gemini-3.5-flash",
        "promptVersion": "sets-v1",
        "batch": "2026-09-20",
        "date": "2026-09-20"
      },
      "verify": {
        "model": "gemini-flash-lite-latest",
        "agreed": true
      },
      "audio": {
        "clips": [
          "audio/354be575f6b35870.mp3",
          "audio/6d8702ecc474c67c.mp3",
          "audio/f5e43f56486d6c56.mp3",
          "audio/a9d92df3e667a293.mp3",
          "audio/6e78e5d49b99d896.mp3",
          "audio/c969beff67accb94.mp3"
        ],
        "voices": {
          "Man": "en-GB-RyanNeural",
          "Woman": "en-GB-SoniaNeural"
        }
      }
    },
    {
      "id": "p3-0003",
      "set": "part3-core",
      "part": 3,
      "status": "active",
      "kind": "conversation",
      "title": "A Delayed Shipment",
      "script": [
        {
          "speaker": "Woman",
          "text": "Mark, have the promotional banners for the annual gala arrived yet? The event is this Thursday."
        },
        {
          "speaker": "Man",
          "text": "Let me check the tracking number... Oh, it says here they're still stuck at the customs facility in Chicago. There's a weather delay."
        },
        {
          "speaker": "Woman",
          "text": "This is a disaster! We can't host the gala without the main sponsor's logos on display."
        },
        {